{
  "schema": "dailyfuel/latest/1",
  "generated_at": "2026-10-06T18:23:02Z",
  "mode": "eia_only",
  "aaa": null,
  "eia": {
    "period": "2026-10-05",
    "prev_period": "2026-09-28",
    "release_date": "2026-10-06",
    "next_release_date": "2026-10-14",
    "us": {
      "price": 5.662,
      "prev": 5.631,
      "change": 0.031,
      "change_pct": 0.55,
      "direction": "up"
    }
  },
  "states": [
    {
      "code": "AL",
      "fips": "01",
      "name": "Alabama",
      "padd": "3",
      "eia_series": "R30",
      "aaa": null,
      "eia": {
        "price": 6.082,
        "prev": 6.051,
        "change": 0.031,
        "change_pct": 0.51,
        "direction": "up"
      },
      "flags": []
    },
    {
      "code": "AK",
      "fips": "02",
      "name": "Alaska",
      "padd": "5",
      "eia_series": null,
      "aaa": null,
      "eia": null,
      "flags": [
        "no_eia_survey"
      ]
    },
    {
      "code": "AZ",
      "fips": "04",
      "name": "Arizona",
      "padd": "5",
      "eia_series": "R5XCA",
      "aaa": null,
      "eia": {
        "price": 6.362,
        "prev": 6.331,
        "change": 0.031,
        "change_pct": 0.49,
        "direction": "up"
      },
      "flags": []
    },
    {
      "code": "AR",
      "fips": "05",
      "name": "Arkansas",
      "padd": "3",
      "eia_series": "R30",
      "aaa": null,
      "eia": {
        "price": 6.082,
        "prev": 6.051,
        "change": 0.031,
        "change_pct": 0.51,
        "direction": "up"
      },
      "flags": []
    },
    {
      "code": "CA",
      "fips": "06",
      "name": "California",
      "padd": "5",
      "eia_series": "SCA",
      "aaa": null,
      "eia": {
        "price": 6.292,
        "prev": 6.261,
        "change": 0.031,
        "change_pct": 0.5,
        "direction": "up"
      },
      "flags": []
    },
    {
      "code": "CO",
      "fips": "08",
      "name": "Colorado",
      "padd": "4",
      "eia_series": "R40",
      "aaa": null,
      "eia": {
        "price": 6.152,
        "prev": null,
        "change": null,
        "change_pct": null,
        "direction": null
      },
      "flags": []
    },
    {
      "code": "CT",
      "fips": "09",
      "name": "Connecticut",
      "padd": "1A",
      "eia_series": "R1X",
      "aaa": null,
      "eia": {
        "price": 5.802,
        "prev": 5.771,
        "change": 0.031,
        "change_pct": 0.54,
        "direction": "up"
      },
      "flags": []
    },
    {
      "code": "DE",
      "fips": "10",
      "name": "Delaware",
      "padd": "1B",
      "eia_series": "R1Y",
      "aaa": null,
      "eia": {
        "price": 5.872,
        "prev": 5.841,
        "change": 0.031,
        "change_pct": 0.53,
        "direction": "up"
      },
      "flags": []
    },
    {
      "code": "DC",
      "fips": "11",
      "name": "District of Columbia",
      "padd": "1B",
      "eia_series": "R1Y",
      "aaa": null,
      "eia": {
        "price": 5.872,
        "prev": 5.841,
        "change": 0.031,
        "change_pct": 0.53,
        "direction": "up"
      },
      "flags": []
    },
    {
      "code": "FL",
      "fips": "12",
      "name": "Florida",
      "padd": "1C",
      "eia_series": "R1Z",
      "aaa": null,
      "eia": {
        "price": 5.942,
        "prev": 5.911,
        "change": 0.031,
        "change_pct": 0.52,
        "direction": "up"
      },
      "flags": []
    },
    {
      "code": "GA",
      "fips": "13",
      "name": "Georgia",
      "padd": "1C",
      "eia_series": "R1Z",
      "aaa": null,
      "eia": {
        "price": 5.942,
        "prev": 5.911,
        "change": 0.031,
        "change_pct": 0.52,
        "direction": "up"
      },
      "flags": []
    },
    {
      "code": "HI",
      "fips": "15",
      "name": "Hawaii",
      "padd": "5",
      "eia_series": null,
      "aaa": null,
      "eia": null,
      "flags": [
        "no_eia_survey"
      ]
    },
    {
      "code": "ID",
      "fips": "16",
      "name": "Idaho",
      "padd": "4",
      "eia_series": "R40",
      "aaa": null,
      "eia": {
        "price": 6.152,
        "prev": null,
        "change": null,
        "change_pct": null,
        "direction": null
      },
      "flags": []
    },
    {
      "code": "IL",
      "fips": "17",
      "name": "Illinois",
      "padd": "2",
      "eia_series": "R20",
      "aaa": null,
      "eia": {
        "price": 6.012,
        "prev": 5.981,
        "change": 0.031,
        "change_pct": 0.52,
        "direction": "up"
      },
      "flags": []
    },
    {
      "code": "IN",
      "fips": "18",
      "name": "Indiana",
      "padd": "2",
      "eia_series": "R20",
      "aaa": null,
      "eia": {
        "price": 6.012,
        "prev": 5.981,
        "change": 0.031,
        "change_pct": 0.52,
        "direction": "up"
      },
      "flags": []
    },
    {
      "code": "IA",
      "fips": "19",
      "name": "Iowa",
      "padd": "2",
      "eia_series": "R20",
      "aaa": null,
      "eia": {
        "price": 6.012,
        "prev": 5.981,
        "change": 0.031,
        "change_pct": 0.52,
        "direction": "up"
      },
      "flags": []
    },
    {
      "code": "KS",
      "fips": "20",
      "name": "Kansas",
      "padd": "2",
      "eia_series": "R20",
      "aaa": null,
      "eia": {
        "price": 6.012,
        "prev": 5.981,
        "change": 0.031,
        "change_pct": 0.52,
        "direction": "up"
      },
      "flags": []
    },
    {
      "code": "KY",
      "fips": "21",
      "name": "Kentucky",
      "padd": "2",
      "eia_series": "R20",
      "aaa": null,
      "eia": {
        "price": 6.012,
        "prev": 5.981,
        "change": 0.031,
        "change_pct": 0.52,
        "direction": "up"
      },
      "flags": []
    },
    {
      "code": "LA",
      "fips": "22",
      "name": "Louisiana",
      "padd": "3",
      "eia_series": "R30",
      "aaa": null,
      "eia": {
        "price": 6.082,
        "prev": 6.051,
        "change": 0.031,
        "change_pct": 0.51,
        "direction": "up"
      },
      "flags": []
    },
    {
      "code": "ME",
      "fips": "23",
      "name": "Maine",
      "padd": "1A",
      "eia_series": "R1X",
      "aaa": null,
      "eia": {
        "price": 5.802,
        "prev": 5.771,
        "change": 0.031,
        "change_pct": 0.54,
        "direction": "up"
      },
      "flags": []
    },
    {
      "code": "MD",
      "fips": "24",
      "name": "Maryland",
      "padd": "1B",
      "eia_series": "R1Y",
      "aaa": null,
      "eia": {
        "price": 5.872,
        "prev": 5.841,
        "change": 0.031,
        "change_pct": 0.53,
        "direction": "up"
      },
      "flags": []
    },
    {
      "code": "MA",
      "fips": "25",
      "name": "Massachusetts",
      "padd": "1A",
      "eia_series": "R1X",
      "aaa": null,
      "eia": {
        "price": 5.802,
        "prev": 5.771,
        "change": 0.031,
        "change_pct": 0.54,
        "direction": "up"
      },
      "flags": []
    },
    {
      "code": "MI",
      "fips": "26",
      "name": "Michigan",
      "padd": "2",
      "eia_series": "R20",
      "aaa": null,
      "eia": {
        "price": 6.012,
        "prev": 5.981,
        "change": 0.031,
        "change_pct": 0.52,
        "direction": "up"
      },
      "flags": []
    },
    {
      "code": "MN",
      "fips": "27",
      "name": "Minnesota",
      "padd": "2",
      "eia_series": "R20",
      "aaa": null,
      "eia": {
        "price": 6.012,
        "prev": 5.981,
        "change": 0.031,
        "change_pct": 0.52,
        "direction": "up"
      },
      "flags": []
    },
    {
      "code": "MS",
      "fips": "28",
      "name": "Mississippi",
      "padd": "3",
      "eia_series": "R30",
      "aaa": null,
      "eia": {
        "price": 6.082,
        "prev": 6.051,
        "change": 0.031,
        "change_pct": 0.51,
        "direction": "up"
      },
      "flags": []
    },
    {
      "code": "MO",
      "fips": "29",
      "name": "Missouri",
      "padd": "2",
      "eia_series": "R20",
      "aaa": null,
      "eia": {
        "price": 6.012,
        "prev": 5.981,
        "change": 0.031,
        "change_pct": 0.52,
        "direction": "up"
      },
      "flags": []
    },
    {
      "code": "MT",
      "fips": "30",
      "name": "Montana",
      "padd": "4",
      "eia_series": "R40",
      "aaa": null,
      "eia": {
        "price": 6.152,
        "prev": null,
        "change": null,
        "change_pct": null,
        "direction": null
      },
      "flags": []
    },
    {
      "code": "NE",
      "fips": "31",
      "name": "Nebraska",
      "padd": "2",
      "eia_series": "R20",
      "aaa": null,
      "eia": {
        "price": 6.012,
        "prev": 5.981,
        "change": 0.031,
        "change_pct": 0.52,
        "direction": "up"
      },
      "flags": []
    },
    {
      "code": "NV",
      "fips": "32",
      "name": "Nevada",
      "padd": "5",
      "eia_series": "R5XCA",
      "aaa": null,
      "eia": {
        "price": 6.362,
        "prev": 6.331,
        "change": 0.031,
        "change_pct": 0.49,
        "direction": "up"
      },
      "flags": []
    },
    {
      "code": "NH",
      "fips": "33",
      "name": "New Hampshire",
      "padd": "1A",
      "eia_series": "R1X",
      "aaa": null,
      "eia": {
        "price": 5.802,
        "prev": 5.771,
        "change": 0.031,
        "change_pct": 0.54,
        "direction": "up"
      },
      "flags": []
    },
    {
      "code": "NJ",
      "fips": "34",
      "name": "New Jersey",
      "padd": "1B",
      "eia_series": "R1Y",
      "aaa": null,
      "eia": {
        "price": 5.872,
        "prev": 5.841,
        "change": 0.031,
        "change_pct": 0.53,
        "direction": "up"
      },
      "flags": []
    },
    {
      "code": "NM",
      "fips": "35",
      "name": "New Mexico",
      "padd": "3",